{
  "$schema": "https://json-schema.org/draft/2020-12/schema",
  "$id": "https://github.com/SBortz/giraflow/blob/main/giraflow.schema.json",
  "title": "Giraflow Schema",
  "description": "A human-readable format for describing event-driven systems using Event Modeling.",
  "type": "object",
  
  "required": ["name", "timeline"],
  
  "properties": {
    "$schema": {
      "type": "string",
      "description": "Reference to the JSON schema"
    },
    "name": {
      "type": "string",
      "description": "Name of the modeled system"
    },
    "description": {
      "type": "string",
      "description": "Description of the system"
    },
    "version": {
      "type": "string",
      "description": "Version of the model",
      "pattern": "^\\d+\\.\\d+\\.\\d+$"
    },
    
    "timeline": {
      "type": "array",
      "description": "The chronologically ordered sequence. The order in the array determines the position on the timeline from left to right.",
      "items": {
        "oneOf": [
          { "$ref": "#/$defs/Event" },
          { "$ref": "#/$defs/StateView" },
          { "$ref": "#/$defs/Actor" },
          { "$ref": "#/$defs/Command" }
        ]
      }
    },
    "specifications": {
      "type": "array",
      "description": "Specifications for commands and state views, grouping scenarios by element name",
      "items": {
        "oneOf": [
          { "$ref": "#/$defs/CommandSpecification" },
          { "$ref": "#/$defs/StateSpecification" }
        ]
      }
    }
  },

  "$defs": {
    "Attachment": {
      "type": "object",
      "description": "Additional information attached to a command or state view (images, links, notes, files)",
      "required": ["type", "label"],
      "properties": {
        "type": {
          "enum": ["image", "link", "note", "file"],
          "description": "The kind of attachment"
        },
        "label": {
          "type": "string",
          "description": "Display label for the attachment"
        },
        "path": {
          "type": "string",
          "description": "Relative file path (for image and file types)"
        },
        "url": {
          "type": "string",
          "format": "uri",
          "description": "URL (for link type)"
        },
        "content": {
          "type": "string",
          "description": "Inline text content (for note type)"
        }
      }
    },

    "EventReference": {
      "type": "object",
      "description": "A reference to an event with optional example data for scenarios",
      "required": ["event"],
      "properties": {
        "event": {
          "type": "string",
          "description": "Name of the event"
        },
        "data": {
          "description": "Event payload data for this scenario"
        }
      }
    },

    "CommandScenarioStep": {
      "oneOf": [
        {
          "type": "object",
          "description": "Context events step",
          "required": ["type", "events"],
          "additionalProperties": false,
          "properties": {
            "type": { "const": "events-only" },
            "events": {
              "type": "array",
              "items": { "$ref": "#/$defs/EventReference" }
            }
          }
        },
        {
          "type": "object",
          "description": "Command execution step (success)",
          "required": ["type", "when", "produces"],
          "additionalProperties": false,
          "properties": {
            "type": { "const": "command" },
            "when": { "description": "Command input/payload" },
            "produces": {
              "type": "array",
              "items": { "$ref": "#/$defs/EventReference" }
            }
          }
        },
        {
          "type": "object",
          "description": "Command execution step (failure)",
          "required": ["type", "when", "fails"],
          "additionalProperties": false,
          "properties": {
            "type": { "const": "command" },
            "when": { "description": "Command input/payload" },
            "fails": { "type": "string" }
          }
        }
      ]
    },

    "CommandScenario": {
      "type": "object",
      "description": "A scenario describing command behavior with context events and outcomes",
      "required": ["name", "steps"],
      "additionalProperties": false,
      "properties": {
        "name": {
          "type": "string",
          "description": "Descriptive name of the scenario"
        },
        "steps": {
          "type": "array",
          "description": "Sequence of context events and command executions",
          "items": { "$ref": "#/$defs/CommandScenarioStep" }
        }
      }
    },

    "StateViewScenario": {
      "type": "object",
      "description": "A Given-Then scenario describing how events project to state",
      "required": ["name", "steps"],
      "properties": {
        "name": {
          "type": "string",
          "description": "Descriptive name of the scenario (e.g. 'Show available books after return')"
        },
        "initialState": {
          "description": "The initial state before any events are processed"
        },
        "steps": {
          "type": "array",
          "description": "Sequence of given-then steps showing state evolution",
          "items": {
            "type": "object",
            "required": ["given", "then"],
            "properties": {
              "given": { "$ref": "#/$defs/EventReference" },
              "then": { "description": "The expected state after processing this event" }
            }
          }
        }
      }
    },

    "Event": {
      "type": "object",
      "description": "An event represents something that has happened. Named in past tense (e.g. OrderPlaced, OrderShipped).",
      "required": ["type", "name", "tick"],
      "additionalProperties": false,
      "properties": {
        "type": {
          "const": "event"
        },
        "name": {
          "type": "string",
          "description": "Name of the event (past tense, e.g. 'OrderPlaced')"
        },
        "tick": {
          "type": "integer",
          "description": "Logical timestamp for ordering on the timeline"
        },
        "producedBy": {
          "type": "string",
          "description": "Reference to the command that produced this event (format: 'CommandName-Tick')"
        },
        "externalSource": {
          "type": "string",
          "description": "For external events: the source system (e.g. 'Carrier Webhook')"
        },
        "system": {
          "type": "string",
          "description": "System/bounded context this event belongs to (determines swimlane)"
        },
        "example": {
          "description": "Example payload of the event"
        }
      }
    },

    "StateView": {
      "type": "object",
      "description": "A state view (read model) built from events. Named as a noun (e.g. PendingOrders, CustomerProfile).",
      "required": ["type", "name", "tick", "sourcedFrom"],
      "additionalProperties": false,
      "properties": {
        "type": {
          "const": "state"
        },
        "name": {
          "type": "string",
          "description": "Name of the state view (noun, e.g. 'PendingOrders')"
        },
        "tick": {
          "type": "integer",
          "description": "Logical timestamp for ordering on the timeline"
        },
        "sourcedFrom": {
          "type": "array",
          "description": "Names of the events this state view subscribes to",
          "items": { "type": "string" }
        },
        "example": {
          "description": "Example state of the view"
        },
        "attachments": {
          "type": "array",
          "description": "Additional information (images, links, notes, files) attached to this state view",
          "items": { "$ref": "#/$defs/Attachment" }
        }
      }
    },

    "Actor": {
      "type": "object",
      "description": "An actor (human or system) that reads views and sends commands. Named as a role (e.g. WarehouseWorker, PaymentGateway).",
      "required": ["type", "name", "tick", "readsView", "sendsCommand"],
      "additionalProperties": false,
      "properties": {
        "type": {
          "const": "actor"
        },
        "name": {
          "type": "string",
          "description": "Name of the actor (role, e.g. 'WarehouseWorker')"
        },
        "tick": {
          "type": "integer",
          "description": "Logical timestamp for ordering on the timeline"
        },
        "readsView": {
          "type": "string",
          "description": "Name of the state view that the actor reads"
        },
        "sendsCommand": {
          "type": "string",
          "description": "Name of the command that the actor sends"
        },
        "wireframes": {
          "type": "array",
          "description": "Wireframe HTML files for this actor's UI (relative paths within the assets folder)",
          "items": { "type": "string" }
        },
        "role": {
          "type": "string",
          "description": "Role category for grouping actors into swimlanes"
        }
      }
    },

    "Command": {
      "type": "object",
      "description": "A command represents an intent to do something. Named in imperative (e.g. ShipOrder, ProcessPayment).",
      "required": ["type", "name", "tick"],
      "additionalProperties": false,
      "properties": {
        "type": {
          "const": "command"
        },
        "name": {
          "type": "string",
          "description": "Name of the command (imperative, e.g. 'ShipOrder')"
        },
        "tick": {
          "type": "integer",
          "description": "Logical timestamp for ordering on the timeline"
        },
        "example": {
          "description": "Example payload of the command"
        },
        "attachments": {
          "type": "array",
          "description": "Additional information (images, links, notes, files) attached to this command",
          "items": { "$ref": "#/$defs/Attachment" }
        }
      }
    },

    "CommandSpecification": {
      "type": "object",
      "description": "A specification grouping scenarios for a command",
      "required": ["name", "type", "scenarios"],
      "additionalProperties": false,
      "properties": {
        "name": {
          "type": "string",
          "description": "Name of the command this specification describes"
        },
        "type": {
          "const": "command"
        },
        "scenarios": {
          "type": "array",
          "items": { "$ref": "#/$defs/CommandScenario" }
        }
      }
    },

    "StateSpecification": {
      "type": "object",
      "description": "A specification grouping scenarios for a state view",
      "required": ["name", "type", "scenarios"],
      "additionalProperties": false,
      "properties": {
        "name": {
          "type": "string",
          "description": "Name of the state view this specification describes"
        },
        "type": {
          "const": "state"
        },
        "scenarios": {
          "type": "array",
          "items": { "$ref": "#/$defs/StateViewScenario" }
        }
      }
    }
  }
}
