{
  "$schema": "../giraflow/giraflow.schema.json",
  "name": "Empty Template",
  "description": "A blank template to start your own model",
  "version": "1.0.0",
  "timeline": [
    {
      "type": "state",
      "name": "InitialState",
      "tick": 1,
      "sourcedFrom": [],
      "example": {}
    },
    {
      "type": "actor",
      "name": "User",
      "tick": 2,
      "readsView": "InitialState",
      "sendsCommand": "DoSomething"
    },
    {
      "type": "command",
      "name": "DoSomething",
      "tick": 3,
      "example": { "data": "example" }
    },
    {
      "type": "event",
      "name": "SomethingHappened",
      "tick": 4,
      "producedBy": "DoSomething-3",
      "example": { "result": "success" }
    }
  ],
  "specifications": []
}
