{
  "$schema": "../information-flow.schema.json",
  "name": "Order Management System",
  "description": "Ein einfaches Bestellsystem zur Demonstration des Information Flow Formats",
  "version": "1.0.0",
  
  "timeline": [
    {
      "type": "event",
      "name": "ProductAddedToCart",
      "tick": 10,
      "example": {
        "cartId": "cart-123",
        "productId": "prod-456",
        "productName": "Wireless Keyboard",
        "quantity": 1,
        "unitPrice": 79.99,
        "addedAt": "2024-01-15T10:30:00Z"
      }
    },
    {
      "type": "event",
      "name": "CartUpdated",
      "tick": 20,
      "example": {
        "cartId": "cart-123",
        "totalItems": 2,
        "totalAmount": 159.98,
        "updatedAt": "2024-01-15T10:32:00Z"
      }
    },
    {
      "type": "state",
      "name": "ShoppingCart",
      "tick": 30,
      "sourcedFrom": ["ProductAddedToCart", "CartUpdated"],
      "example": {
        "cartId": "cart-123",
        "customerId": "cust-789",
        "items": [
          { "productId": "prod-456", "name": "Wireless Keyboard", "quantity": 1, "price": 79.99 },
          { "productId": "prod-457", "name": "Mouse Pad", "quantity": 1, "price": 19.99 }
        ],
        "totalAmount": 99.98
      }
    },
    {
      "type": "actor",
      "name": "Customer",
      "tick": 40,
      "readsView": "ShoppingCart",
      "sendsCommand": "PlaceOrder"
    },
    {
      "type": "command",
      "name": "PlaceOrder",
      "tick": 50,
      "example": {
        "cartId": "cart-123",
        "customerId": "cust-789",
        "shippingAddress": {
          "street": "Musterstraße 42",
          "city": "Berlin",
          "zip": "10115"
        },
        "paymentMethod": "credit_card"
      }
    },
    {
      "type": "event",
      "name": "OrderCreated",
      "tick": 60,
      "producedBy": "PlaceOrder-50",
      "example": {
        "orderId": "order-001",
        "customerId": "cust-789",
        "items": [
          { "productId": "prod-456", "name": "Wireless Keyboard", "quantity": 1, "price": 79.99 }
        ],
        "totalAmount": 79.99,
        "status": "pending",
        "createdAt": "2024-01-15T10:35:00Z"
      }
    },
    {
      "type": "state",
      "name": "OrderConfirmation",
      "tick": 70,
      "sourcedFrom": ["OrderCreated"],
      "example": {
        "orderId": "order-001",
        "message": "Vielen Dank für Ihre Bestellung!",
        "estimatedDelivery": "2024-01-18",
        "totalAmount": 79.99
      }
    },
    {
      "type": "state",
      "name": "PendingOrders",
      "tick": 80,
      "sourcedFrom": ["OrderCreated", "OrderPaid"],
      "example": {
        "orders": [
          { "orderId": "order-001", "customerId": "cust-789", "amount": 79.99, "status": "pending" }
        ]
      }
    },
    {
      "type": "actor",
      "name": "PaymentProcessor",
      "tick": 90,
      "readsView": "PendingOrders",
      "sendsCommand": "ProcessPayment"
    },
    {
      "type": "command",
      "name": "ProcessPayment",
      "tick": 100,
      "example": {
        "orderId": "order-001",
        "amount": 79.99,
        "paymentMethod": "credit_card",
        "cardToken": "tok_visa_4242"
      }
    },
    {
      "type": "event",
      "name": "OrderPaid",
      "tick": 110,
      "producedBy": "ProcessPayment-100",
      "example": {
        "orderId": "order-001",
        "paymentId": "pay-555",
        "amount": 79.99,
        "paidAt": "2024-01-15T10:36:00Z"
      }
    },
    {
      "type": "event",
      "name": "PaymentFailed",
      "tick": 120,
      "producedBy": "ProcessPayment-100",
      "example": {
        "orderId": "order-001",
        "reason": "Insufficient funds",
        "failedAt": "2024-01-15T10:36:00Z"
      }
    },
    {
      "type": "state",
      "name": "OrdersReadyToShip",
      "tick": 130,
      "sourcedFrom": ["OrderPaid", "OrderShipped"],
      "example": {
        "orders": [
          { "orderId": "order-001", "customerId": "cust-789", "paidAt": "2024-01-15T10:36:00Z" }
        ]
      }
    },
    {
      "type": "actor",
      "name": "WarehouseWorker",
      "tick": 140,
      "readsView": "OrdersReadyToShip",
      "sendsCommand": "ShipOrder"
    },
    {
      "type": "command",
      "name": "ShipOrder",
      "tick": 150,
      "example": {
        "orderId": "order-001",
        "trackingNumber": "DHL-123456789",
        "carrier": "DHL"
      }
    },
    {
      "type": "event",
      "name": "OrderShipped",
      "tick": 160,
      "producedBy": "ShipOrder-150",
      "example": {
        "orderId": "order-001",
        "trackingNumber": "DHL-123456789",
        "carrier": "DHL",
        "shippedAt": "2024-01-16T14:00:00Z"
      }
    },
    {
      "type": "state",
      "name": "CustomerOrderTracking",
      "tick": 170,
      "sourcedFrom": ["OrderCreated", "OrderPaid", "OrderShipped", "OrderDelivered"],
      "example": {
        "orderId": "order-001",
        "status": "shipped",
        "trackingNumber": "DHL-123456789",
        "timeline": [
          { "status": "created", "at": "2024-01-15T10:35:00Z" },
          { "status": "paid", "at": "2024-01-15T10:36:00Z" },
          { "status": "shipped", "at": "2024-01-16T14:00:00Z" }
        ]
      }
    },
    {
      "type": "event",
      "name": "OrderDelivered",
      "tick": 180,
      "externalSource": "Carrier Webhook",
      "example": {
        "orderId": "order-001",
        "deliveredAt": "2024-01-18T11:23:00Z",
        "signature": "M. Mustermann"
      }
    }
  ]
}
